title,category,publish_date,article_url,content
BNI Optimistis Bisnisnya Makin Moncer di Era Pemerintahan Baru,detikFinance,"Jumat, 25 Okt 2024 20:30 WIB",https://finance.detik.com/moneter/d-7606593/bni-optimistis-bisnisnya-makin-moncer-di-era-pemerintahan-baru,"PT Bank Negara Indonesia (Persero) Tbk atau BNI (BBNI) optimistis dengan pertumbuhan bisnis di masa pemerintahan baru Presiden Prabowo Subianto. Terdapat peluang besar untuk berekspansi sejalan dengan visi misi dan program-program prioritas.

Direktur Utama BNI Royke Tumilaar mengatakan BNI terus menunjukkan konsistensi dalam mendukung pertumbuhan ekonomi nasional dengan mengoptimalkan peluang ekspansi yang tersedia.

""Kita melihat peluang pertumbuhan bisnis yang signifikan dan berkelanjutan sejalan dengan visi pemerintah,"" kata Royke, dalam Konferensi Pers Paparan Kinerja Kuartal III 2024 BNI, disiarkan secara daring, Jumat (25/10/2024).


    SCROLL TO CONTINUE WITH CONTENT
  

Adapun visi tersebut meliputi peningkatan PDB, pengentasan kemiskinan serta berbagai program sektoral seperti infrastruktur ketahanan energi dan pangan, pemberdayaan UMKM, juga hilirisasi industri termasuk pertanian serta program perumahan.

""Optimisme terhadap kebijakan prioritas ekonomi pemerintah baru yang diiringi dengan proses transisi yang berjalan lancar diharapkan dapat menjadi katalisator pertumbuhan kredit di sektor perbankan di masa mendatang,"" ujarnya.

Per September 2024, BNI sendiri mencatatkan penyaluran kredit per September 2024 senilai Rp 735,02 triliun. Angka ini naik 9,48% secara tahunan (yoy) dibandingkan setahun sebelumnya yang tercatat Rp 671,37 triliun.

Pertumbuhan ini didorong oleh segmen korporasi yang mencatat kenaikan sebesar 15,1% YoY menjadi Rp 409,2 triliun. Selain itu, segmen konsumer secara keseluruhan mencatat pertumbuhan 14,6% YoY menjadi Rp 137 triliun, dengan kredit personal (payroll) dan Kredit Pemilikan Rumah (KPR) sebagai pendorong utama.

Royke menyakini, program-program unggulan pemerintah seperti hilirisasi hingga ketahanan pangan akan mendukung kinerja perbankan. Hal ini mengingat hilirisasi bertujuan untuk meningkatkan nilai tambah dari komoditas yang ada di Indonesia.

Menurutnya, hal ini tentunya akan membuat banyak sekali peningkatan dari sisi kebutuhan modal atau kapital untuk mendukung pembangunan di hilirisasi. Ini juga termasuk dengan ketahanan pangan. Royke membidik peningkatan di sisi kredit dan pendanaan di masa mendatang.

""Jadi program pemerintah yang sekarang jelas tidak ada keraguan dari kami di BNI untuk tidak mendukung. Karena itu pasti jelas akan menambah nilai prospek dari kita untuk membiayai banyak pengusaha-pengusaha yang akan terlibat di dalam hilirisasi maupun untuk di ketahanan pangan,"" kata dia."
"Prabowo Sudah Panggil Calon Menteri, IHSG Diprediksi Menguat ke 7.600",detikFinance,"Selasa, 15 Okt 2024 08:35 WIB",https://finance.detik.com/market-research/d-7588272/prabowo-sudah-panggil-calon-menteri-ihsg-diprediksi-menguat-ke-7-600,"Indeks Harga Saham Gabungan (IHSG) pada perdagangan Senin (14/10) ditutup menguat +0,52% atau +39,05 poin ke level 7.559. IHSG hari ini (15/10) diprediksi bergerak menguat dalam kisaran 7.500-7.600.

Financial Expert Ajaib Sekuritas, Ratih Mustikoningsih dalam risetnya menjelaskan, sentimen yang mempengaruhi pergerakan IHSG hari ini antara lain, dari dalam negeri IHSG kembali menguat menjelang pengumuman posisi menteri pada pemerintahan baru Prabowo-Gibran.

Sementara, nilai tukar rupiah JISDOR yang kembali menguat ke level USD 15.581 per dolar AS juga memberikan sentimen positif bagi pasar ekuitas. Di sisi lain, Bank Indonesia (BI) melaporkan Utang Luar Negeri (ULN) pada Agustus 2024 sebesar US$ 425,1 miliar atau tumbuh 7,3% yoy, sekaligus lebih tinggi dibandingkan pada bulan sebelumnya sebesar US$ 414,3 miliar.


    SCROLL TO CONTINUE WITH CONTENT
  

""Kenaikan ULN terjadi pada segment ULN pemerintah dan ULN Swasta. Jika di akumulasi, rasio ULN terhadap PDB sebesar 31%, dimana sebesar 84,3% didominasi oleh utang jangka panjang. Sementara, pekan ini pelaku pasar menanti keputusan suku bunga BI-Rate yang berpotensi turun 25 bps menjadi 5,75%,"" tulisnya dalam riset, Selasa (15/10/2024).

Dari mancanegara, Bursa Wall Street menguat terbatas, namun Indeks Dow Jones dan Nasdaq kembali melaporkan rekor all time high. Pelaku pasar optimis pendapatan emiten tetap solid meskipun mendapat tekanan dari suku bunga yang tinggi. Dari Asia, surplus neraca dagang Tiongkok pada September 2024 sebesar USD 81,71 miliar atau lebih tinggi dibandingkan periode yang sama tahun lalu sebesar USD 75,5 miliar. Secara tahunan ekspor tumbuh 2,4%, semantara impor tumbuh minimalis sebesar 0,3% sejalan lesunya daya beli.

INDYBuy: 1.715TP: 1.770Stop loss: 1.645

INDY bullish continuation di atas MA 5,20,100. Indikator stochastic crossing dan bergerak naik. Indikator MACD bar histogram melemah terbatas.Harga batu bara ICE Newcastle kontrak November menguat +1% menjadi USD150,9 per metrik ton (14/10/2024). Kenaikan tersebut dipengaruhi oleh rencana China memperbesar defisit fiskal untuk mendorong sektor konsumsi dan properti.

ARTOBuy: 2.920TP: 3.020Stop loss: 2.780

ARTO berpotensi bullish reversal membentuk pola morning star di area support. Indikator MACD bar histogram melemah terbatas dalam momentum akumulasi.

Potensi BI-Rate yang kembali turun 25 bps ke level 5,75% memberikan katalis positif bagi bank digital. Adapun penetrasi ekonomi digital juga berpotensi terus tumbuh. Pada Agustus 2024, transaksi QRIS tumbuh 217,33% yoy dengan jumlah pengguna mencapai 52,55 juta dan jumlah merchant sebesar 33,77 juta.

BBNIBuy: 5.425TP: 5.575Stop loss: 5.300

BBNI berpotensi bullish reversal membentuk inverse hammer di area support. Indikator MACD bar histogram melemah terbatas dalam momentum akumulasi.

Per Agustus 2024, BBNI melaporkan kenaikan laba bersih 4,25% yoy menjadi Rp14,22 triliun. Sementara, penyaluran kredit tumbuh 8,96% yoy menjadi Rp 710,48 triliun yang membawa pendapatan bunga Rp42,47 triliun atau tumbuh 4,94% yoy.

Simak Video: IHSG Menguat 2 Poin Menjelang Akhir Pekan"
Catat! Saham yang Bakal Cuan Hari Ini,detikFinance,"Rabu, 09 Okt 2024 09:04 WIB",https://finance.detik.com/market-research/d-7578984/catat-saham-yang-bakal-cuan-hari-ini,"Indeks Harga Saham Gabungan (IHSG) pada perdagangan pagi ini diperkirakan bergerak flukfuatif cenderung menguat terbatas di level 7.500-7.600.

Hal ini berdasarkan hasil Riset Mega Capital Sekuritas dan InvestasiKu, Rabu (9/10/2024). Di tengah pelemahan bursa regional, IHSG berhasil menguat 0.71% ke 7557. Aksi jual investor asing terlihat mulai mereda dan justru berpotensi kembali masuk atas sentiment fiskal Tiongkok yang mengecewakan investor. Pada perdagangan 8 Oktober lalu, investor asing net buy dengan nilai yang rendah yaitu Rp 39.74 miliar di pasar regular. Atas sentiment meredanya konflik di Timur Tengah dan penurunan harga minyak yang drastic berpotensi menjadi sentiment positif bagi IHSG seiring memudarnya ekspektasi kenaikan harga BBM bersubsidi pada 4Q24.

Sementara di bursa global, bursa saham Wall Street kompak menguat dipimpin oleh indeks Nasdaq yang menguat 1.45%. Penguatan ini dipicu oleh kenaikan harga saham Nvidia (NVDA) yang melesat 4% setelah CEO Foxconn yang merupakan konsumen utama NVDA mengatakan potensi permintaan chip Blackwell akan meningkat yang memberikan optimisme pada outlook permintaan chip global. Selain itu, konflik geopolitik di Timur Tengah mulai mereda setelah AS mencegah Israel menyerang kilang minyak Iran.


    SCROLL TO CONTINUE WITH CONTENT
  

Hal ini direspons dengan penurunan signifikan harga minyak mentah hingga 4% dalam sehari. Beralih ke bursa Asia, pelemahan dipimpin oleh indeks Hangseng yang melemah 9.41% dalam sehari. Hal ini terjadi akibat kekecewaan investor atas stimulus jumbo pemerintah Tiongkok yang dinilai tidak berkomitmen dan tidak visible. Bank Dunia bahkan merevisi turun proyeksi pertumbuhan ekonomi China dari 4.8% di 2024 menjadi hanya 4.3% pada 2025 mendatang.

Merespons sentiment di atas, bursa saham Eropa kompak melemah dengan pelemahan dipimpin oleh saham terkait barang mewah dan minuman keras akibat potensi perekonomian China yang lebih lemah.

Berikut rekomendasi saham dari Mega Capital Sekuritas dan InvestasiKu:

BBNI reject minor support dan harga bertahan diatas area flip-over diikuti kenaikan volume, berpotensi lanjut menguat menuju harmonic resistance didukung stochastic bullish crossover.

Rekomendasi : BuyEntry Level : 5275-5350Take Profit : 5425-5525Stop Loss : 5200

BNGA : rebound dari support uptrend line dan harga reject support MA 200, berpotensi lanjut menguat menuju resistance uptrend line didukung kenaikan volume.

Rekomendasi : BuyEntry Level : 1850-1870Take Profit : 1890-1915Stop Loss : 1830

MAPA: rebound dari support uptrend channel membentuk marubozu candle dan harga break MA 200, berpotensi lanjut menguat menuju resistance uptrend channel didukung stochastic bullish crossover.

Rekomendasi : BuyEntry Level : 885-900Take Profit : 915-935Stop Loss : 870

CTRA: berada pada secondary uptrend movement dan harga bertahan di atas EMA 100, berpotensi lanjut rally menguji dynamic resistance didukung momentum MACD goldencross.

Rekomendasi : BuyEntry Level : 1310-1330Take Profit : 1345-1365Stop Loss : 1295

PTRO: sedang membentuk bullish continuation pattern berupa ascending triangle dan saat ini harga berada di atas support pola tersebut berpotensi lanjut menguat menembus neckline didukung momentum MACD golden cross.

Rekomendasi : BuyEntry Level : 13800-13950Take Profit : 14100-14500Stop Loss : 13600

Sementara itu, berdasarkan riset dari Ajaib Sekuritas melihat sentimen yang mempengaruhi pergerakan IHSG hari ini antara lain, dari dalam negeri, IHSG menguat ditopang oleh pergerakan saham Big Caps yang tercermin dari Indeks LQ45 terapresiasi +1,28%. Saham Big Banks kompak rebound setelah dalam beberapa minggu terakhir koreksi. Meskipun IHSG rebound, investor asing masih mencatatkan jual bersih di pasar ekuitas domestik senilai Rp165,66 miliar (8/10/2024).

Di sisi lain, Bank Indonesia (BI) melaporkan Indeks Keyakinan Konsumen (IKK) pada September 2024 berada di level 123,5 atau lebih rendah dibandingkan bulan sebelumnya sebesar 124,4. Penurunan IKK sejalan dengan data deflasi bulanan yang terjadi dalam 5 bulan beruntun hingga September 2024.

Dari mancanegara, Bursa Wall Street mengalami akselerasi. Pelaku pasar menunggu rapat risalah FOMC nanti malam. Isyarat pemangkasan suku bunga berpotensi masih terjadi dalam beberapa pertemuan ke depan. The Fed berpotensi melanjutkan pemangkasan suku bunga 25 bps lanjutan pada FOMC November mendatang.

Dari Asia, Jepang melaporkan posisi Cadangan Devisa (Cadev) pada September 2024 di level US$ 1,24 triliun atau naik US$ 19,14 miliar dari bulan sebelumnya. Posisi tersebut merupakan level tertinggi sejak April 2024. Cadangan emas mencapai US$ 71,52 miliar lebih tinggi dari bulan Agustus 2024 sebesar US$ 68,36 miliar. IHSG hari ini diprediksi menguat dalam range 7.500.-7.600.

Rekomendasi saham dari Ajaib Sekuritas:

BMRIAccumulative Buy: 7.075TP: 7.300Stop loss: 6.700

BMRI berpotensi bullish reversal di area support membentuk long white candle. Indikator MACD bar histogram melemah terbatas dalam momentum akumulasi diiringi penguatan volume.

BMRI hingga Agustus 2024 berhasil membukukan kenaikan net interest income (NII) 4% yoy menjadi Rp49,5 triliun. Sementara, laba bersih sebelum pencadangan (PPOP) tumbuh 6,6% yoy menjadi Rp47,3 triliun. Secara bottom line laba bersih tumbuh 6,5% yoy menjadi Rp33,6 triliun.

ACESBuy: 860TP: 890Stop loss: 835

ACES berpotensi bullish reversal dalam jangka pendek. Secara major tren bullish continuation membentuk higher low. Indikator stochastic crossing di area oversold to middle indikasi menguat jangka pendek.

Segmen konsumsi non primer menarik dicermati ketika sinyal pemangkasan suku bunga The Fed berlanjut. Adapun Indeks Keyakinan Konsumen pada September 2024 juga masih di level optimis sebesar 123,5 meskipun sedikit lebih rendah dibandingkan bulan sebelumnya sebesar 124,4.

ARTOBuy: 2.870TP: 2.980Stop loss: 2.750

ARTO bullish reversal dalam jangka pendek di atas MA (100). Indikator MACD bar histogram melemah terbatas indikasi rebound jangka pendek.

Emiten digital banking menarik dicermati seiring dengan pemangkasan suku bunga The Fed pada September 2024 sebesar 50 bps. Adapun penetrasi ekonomi digital juga berpotensi terus tumbuh. Pada Agustus 2024, transaksi QRIS tumbuh 217,33% yoy dengan jumlah pengguna mencapai 52,55 juta dan jumlah merchant sebesar 33,77 juta."
"Pertama di Luar Jawa, BNI & UNUD Bangun Campus Financial Ecosystem",detikEdu,"Jumat, 25 Mar 2022 19:50 WIB",https://www.detik.com/edu/perguruan-tinggi/d-6001262/pertama-di-luar-jawa-bni-unud-bangun-campus-financial-ecosystem,"PT Bank Negara Indonesia (Persero) Tbk atau BNI (kode saham: BBNI) kembali melakukan ekspansi program Campus Financial Ecosystem dengan menggandeng Universitas Udayana (UNUD). UNUD menjadi kampus pilihan di luar Pulau Jawa sebagai wujud nyata konsistensi BNI sebagai bank yang sangat dekat dengan kampus melalui program Campus Financial Ecosystem.

Program ini merupakan solusi transaksional dan non transaksional lengkap dan terbaik untuk memenuhi kebutuhan Civitas Akademika. Mulai dari mahasiswa, dosen, pegawai, alumni, vendor hingga pelaku usaha di lingkungan kampus sehingga akan terwujud pendidikan yang bermutu.

BNI dan UNUD melakukan Kick Off Campus Financial Ecosystem melalui Penandatanganan Nota Kesepahaman (MoU) tentang Ekosistem Keuangan Perguruan Tinggi, Jumat (25/3). Penandatangan ini dilakukan oleh Rektor Universitas Udayana I Nyoman Gde Antara dan Direktur Hubungan Kelembagaan BNI Sis Apik Wijayanto bertempat di Gedung Rektorat Universitas Udayana, Denpasar.


SCROLL TO CONTINUE WITH CONTENT


Selain Penandatanganan Naskah Nota Kesepahaman (MoU), BNI dan UNUD melakukan integrasi sistem keuangan melalui Cash Management System, program pemberian fasilitas kredit tanpa agunan bagi pegawai dan dosen yang disebut sebagai BNI Fleksi; pembiayaan kredit BNI Fleksi pendidikan bagi mahasiswa S2 & S3; penerbitan Kartu Kredit Affinity; program magang bagi mahasiswa S1, serta program dukungan bagi UMKM binaan Universitas Udayana melalui BNI Edupreneur.

Sis Apik mengatakan BNI terus melakukan digitalisasi kampus dan kali ini berkolaborasi dengan UNUD untuk memberikan pelayanan lengkap bagi seluruh civitas akademika melalui program BNI Campus Financial Ecosystem.

""Kami sangat mengapresiasi kerja sama Campus Financial Ecosystem dengan UNUD. Kami tentunya akan semakin proaktif memberikan solusi keuangan yang terintegrasi berbasis digital dan sesuai dengan kebutuhan segenap Civitas Akademika, dari mulai solusi keuangan bagi Kampus UNUD, dosen atau staf pengajar, staf pegawai, mahasiswa, bahkan lebih luas lagi, sampai dengan keluarga mahasiswa dan pelaku usaha di sekitar kampus UNUD,"" katanya dalam keterangan tertulis, Jumat (25/3/2022).

Adapun, BNI Campus Financial Ecosystem merupakan program yang tepat dalam mendukung upaya UNUD dalam mewujudkan pendidikan yang bermutu dan menghasilkan lulusan berintegritas tinggi sesuai tuntutan masyarakat lokal dan internasional.

Selain hal tersebut, BNI berharap Program Ekosistem Keuangan Kampus ini dapat membantu mewujudkan UNUD menuju Cashless Society yang terintegrasi dengan layanan yang dikembangkan oleh BNI. BNI menyediakan solusi digital terintegrasi dalam rangka memberikan efisiensi dan efektifitas dalam pengelolaan kegiatan di Universitas Udayana .

Sebelumnya, BNI juga telah bekerja sama dengan Universitas Udayana meliputi beberapa layanan yang telah dipergunakan dan terbukti mempermudah layanan transaksional baik bagi mahasiswa, maupun civitas akademika Udayana. Layanan tersebut meliputi Student Payment Center (SPC) Host to Host, pembayaran tunjangan kinerja, pengelolaan keuangan , penempatan Outlet BNI di lingkungan kampus.

Tentunya, dengan adanya Program Campus Financial Ecosystem yang dilakukan penandatanganannya pada hari ini membuat BNI semakin komprehensif dalam memberikan solusi-solusi keuangan dan non keuangan, serta meningkatkan value kedua belah pihak."
