title,category,publish_date,article_url,content
"Dunia Menyambut Prabowo, Presiden ke-8 Republik Indonesia",detikNews,"Senin, 19 Feb 2024 11:08 WIB",https://news.detik.com/kolom/d-7200280/dunia-menyambut-prabowo-presiden-ke-8-republik-indonesia,"Banyak orang senang mendengar lagu-lagu lama. Tak pernah bosan meski diputar berulang-ulang. Tak ketinggalan dengan Pilpres 2024. ""Lagu lama"" soal kecurangan pemilu, bergema merespons kemenangan telak sekali putaran Prabowo-Gibran.

Tudingan dan kecurigaan itu bisa dipahami. Bagaimana pun, kemenangan Prabowo-Gibran adalah sejarah dalam politik demokrasi Indonesia, khususnya di era reformasi. Untuk pertama kalinya kontestasi pilpres yang berisi pertarungan lebih dari dua paslon dimenangkan hanya dengan sekali putaran.

Namun, jika dilihat dengan kacamata holistik, seperti kata Profesor Mahfud MD, tuduhan kecurangan adalah lagu yang biasa didendangkan oleh mereka yang kalah. Secara puitik bahkan dapat dikatakan, menuduh curang adalah hak istimewa yang hanya dimiliki oleh mereka yang kalah. Pendapat Prof Mahfud ini sungguh layak didengar dan mestinya tidak dilupakan.


SCROLL TO CONTINUE WITH CONTENT


Kisah serupa sebenarnya bisa kita temukan di berbagai penjuru dunia. Pada Pilpres Amerika Serikat tahun 2020 misalnya, kubu Donald Trump secara konsisten dan masif mengatakan kemenangan Joe Biden sebagai bentuk kecurangan. Tuduhan itu bahkan belum berhenti sampai sekarang.

Filsuf Jerman Friedrich Nietzsche menyebut perilaku semacam itu sebagai slave mentality atau ""mental budak"". Alih-alih berlapang dada mengakui kekalahan, mereka yang bermental budak (bukan bermental kesatria) akan mencari ribuan pembenaran dan penyangkalan atas kekalahannya.

Ini ibarat orang yang tidak mampu membeli mobil mewah. Alih-alih bekerja keras agar bisa membeli mobil mewah seperti tetangganya, ia justru menyebut tetangganya sedang pamer kekayaan dan bersikap sombong.

Dalam perspektif intelijen, narasi kecurangan yang dituduhkan kepada Prabowo-Gibran saat ini telah masuk ke tahap intensifikasi. Ada empat langkah yang sedang dan telah dilakukan. Pertama, kubu 01 dan 03 membuat siaran pers yang memberi sinyal-sinyal ke masyarakat bahwa kecurangan itu ada.

Merespons hasil quick count, kubu 01 dan 03 terlihat menggunakan narasi yang nyaris seragam. Seolah-olah kemenangan sekali putaran Prabowo-Gibran tidak mungkin terjadi. TPN Ganjar-Mahfud bahkan melempar sinyal seolah-olah akan menggandeng Timnas AMIN untuk mengusut berbagai dugaan kecurangan di Pilpres 2024.

Kedua, media sosial dibanjiri dengan berbagai konten yang menunjukkan kecurangan pemilu. Dulu, Menteri Propaganda Nazi Paul Joseph Goebbels menggunakan teknik semacam ini. Prinsip dari teknik Goebbels adalah menyebarluaskan berita bohong melalui media massa sebanyak mungkin dan sesering mungkin hingga kemudian kebohongan tersebut dianggap sebagai suatu kebenaran. Sederhana namun mematikan.

Ketiga, dibuatnya pemberitaan bahwa dunia internasional tidak menerima kemenangan Prabowo-Gibran. Terlihat adanya upaya untuk mengamplifikasi berbagai headline pemberitaan media asing yang menggunakan diksi-diksi negatif terhadap Prabowo-Gibran. Strategi ini jelas menggunakan prinsip inferiority complex. Diksi-diksi negatif itu seolah valid, hanya karena diberitakan oleh media-media asing.

Keempat, meskipun belum terjadi, namun bau-baunya sudah tercium. Dikhawatirkan tahap intensifikasi akan menuju pada tahap eksploitasi dalam beberapa pekan ke depan. Mereka yang tidak menerima hasil Pilpres 2024 akan melakukan berbagai demonstrasi penolakan. Modus operandi seperti ini juga terlihat di Pilpres Amerika Serikat 2020.

Singkatnya, tuduhan kecurangan sangat mungkin akan terus bergema sampai pelantikan resmi di bulan Oktober nanti. Oleh karenanya, saya akan menggunakan pengukuran yang lebih objektif dalam melihat kemenangan Prabowo-Gibran di Pilpres 2024, yakni pengakuan negara lain.

Pengakuan negara lain atau negara sahabat adalah legitimasi objektif. Saya mengatakan objektif karena negara-negara tersebut jelas bukan partisan. Mereka bukan kubu 01 atau kubu 03 yang menjadi kompetitor Prabowo-Gibran. Kemudian, ini yang terpenting, ucapan selamat tidak mungkin disampaikan secara sembarangan oleh suatu negara.

Kembali saya tekankan, berbagai ucapan selamat itu tidak mungkin sembarang dikeluarkan. Pasti sudah ada verifikasi, konfirmasi, informasi A1, dan berbagai uji validitas sebelum ucapan diberikan. Ada peran lembaga intelijen tiap negara untuk memberikan informasi yang akurat dan terpercaya. Apalagi setahu saya, setiap kali Indonesia menggelar pemilu, banyak negara counterpart mengirimkan petugas intelijennya untuk ikut memantau.

Hingga hari ini, ucapan selamat ke Prabowo Subianto sudah datang dari sejumlah negara tetangga, Eropa, hingga Amerika Serikat. Ada yang menelpon secara langsung, ada yang melalui media sosial, ada pula yang mengutus duta besarnya untuk bertemu langsung.

Dari kawasan tetangga ada Perdana Menteri Malaysia Anwar Ibrahim, Perdana Menteri Australia Anthony Albanese, Perdana Menteri Singapura Lee Hsien Loong dan Presiden Sri Lanka Ranil Wickremesinghe. Dari Eropa ada Perdana Menteri Republik Ceko Petr Fiala, Perdana Menteri Belanda Mark Rutte, Presiden Rusia Vladimir Putin, dan Perdana Menteri Inggris Rishi Sunak. Dari Amerika Serikat, ucapan selamat juga sudah disampaikan oleh Juru Bicara Departemen Luar Negeri Amerika Serikat, Matthew Miller.

Dalam hubungan internasional, ucapan selamat oleh suatu negara tidak sama dengan ucapan selamat dalam hubungan sehari-hari yang kerap kali hanya bersifat normatif. Dalam hubungan internasional, sebuah ucapan selamat apalagi yang menyangkut hasil pemilu, hanya menegaskan bahwa yang bersangkutan telah diakui kemenangannya.

Mirip seperti pengakuan kemerdekaan, ucapan selamat dari berbagai pemimpin dunia itu merupakan pengakuan mereka bahwa Prabowo Subianto telah terpilih sebagai Presiden ke-8 Republik Indonesia.

Ucapan selamat itu, menurut saya sebenarnya juga dapat diliihat sebagai buah dari kiprah diplomasi pertahanan Prabowo selama menjadi Menteri Pertahanan (Menhan). Secara meyakinkan dapat dikatakan bahwa Prabowo telah berhasil membangun hubungan dan komunikasi internasional yang baik.

Kunjungannya ke berbagai negara di Asia, Eropa, hingga Amerika bukan hanya sekadar untuk membahas rencana belanja alutsista, melainkan juga untuk membangun pertemanan internasional yang hangat. Tak mengherankan jika kini, negara-negara tersebut kemudian mengaku siap untuk membangun kerja sama dengan Indonesia di bawah kepemimpinan Prabowo Subianto.

Dengan kata lain, ucapan selamat yang terus mengalir untuk Prabowo, sesungguhnya merupakan bantahan tegas atas narasi-narasi buruk yang menyebut seolah-olah dunia internasional tidak menerima kemenangan Prabowo-Gibran. Apalagi, sambutan dunia terhadap Prabowo tidak hanya terlihat dari ucapan selamat berbagai negara, melainkan juga dari pandangan positif pengamat luar negeri.

Profesor Hubungan Internasional dan Politik Komparatif Universitas Sydney, Justin Hastings misalnya, mengatakan Australia akan cepat bekerja sama dengan Prabowo karena kebijakan luar negerinya akan mengikuti kontur kebijakan pemerintah sebelumnya, yakni pemerintahan Jokowi.

Hastings juga menegaskan bahwa Prabowo akan menjadi Presiden pro-Indonesia, Presiden yang tidak condong atau anti dengan Amerika Serikat, Australia ataupun Tiongkok. Dengan Prabowo yang tidak begitu kritis terhadap AUKUS jika dibandingkan pemimpin Asia Tenggara lainnya, Hastings melihat prospek kesepakatan pertahanan Australia dan Indonesia akan lebih positif di bawah Prabowo.

Selain ucapan selamat, hangatnya sambutan terhadap kemenangan Prabowo-Gibran juga terlihat jelas dari pasar ekonomi. Pasar keuangan Indonesia dan Wall Street merespons positif hasil Pilpres 2024 yang dimenangkan sekali putaran.

Indeks Harga Saham Gabungan (IHSG) melesat. IHSG pada penutupan perdagangan pada Kamis (15/2/2024) ditutup di posisi 7.303,28. Indeks menguat 93,5 poin atau 1,30 persen.

Penguatan IHSG terjadi seiring dengan melesatnya saham bank big cap. Empat bank buku-IV dengan kapitalisasi pasar terbesar di IHSG kompak menguat. Bank Rakyat Indonesia (Persero) Tbk (BBRI) melonjak 2,08 persen, Bank Mandiri (Persero) Tbk (BMRI) naik 2,49 persen, Bank Negara Indonesia (Persero) Tbk (BBNI) terapresiasi 2,13 persen, dan Bank Central Asia Tbk (BBCA) menguat 1,29 persen.

Salah satu saham yang kenaikannya menjadi sorotan adalah PT PP (Persero) Tbk (PTPP), sebagai salah satu BUMN karya yang terimbas positif dengan kuatnya suara Prabowo-Gibran, baik di quick count maupun real count KPU.

Melesatnya saham PTPP disebabkan karena Prabowo akan melanjutkan program pembangunan era Presiden Jokowi, khususnya Ibu Kota Nusantara (IKN). Pada perdagangan Kamis lalu, saham PTPP melambung hingga 24,44 persen.

***

Sebagai penutup, selain memberi selamat atas kemenangan sekali putaran Prabowo-Gibran, bolehlah kita sedikit genit bermain tebak-tebakan. Dunia sudah menyambut dan menggelar karpet merah, lantas negara manakah yang akan menjadi tujuan kunjungan pertama Prabowo setelah terpilih sebagai Presiden ke-8 Republik Indonesia?

Jakarta, 19 Februari 2024

KHAIRUL FAHMIInstitute for Security and Strategic Studies (ISESS)"
BNI Dukung Technopreneurship Trisakti untuk Genjot Rasio Kewirausahaan RI,detikNews,"Kamis, 30 Nov 2023 09:44 WIB",https://news.detik.com/berita/d-7064007/bni-dukung-technopreneurship-trisakti-untuk-genjot-rasio-kewirausahaan-ri,"PT Bank Negara Indonesia (Persero) Tbk (BBNI) mendukung Technopreneurship Universitas Trisakti. Langkah itu dilakukan untuk mengenjot rasio kewirausahaan di Indonesia.

Direktur Institutional Banking BNI Muhammad Iqbal mengatakan kewirausahaan saat ini menjadi fokus pemerintah untuk ditingkatkan. Pasalnya rasio kewirausahaan Indonesia di ASEAN baru tercatat sebesar 3,47%.

Hal tersebut diungkapkan olehnya di Iqbal dalam rangkaian kegiatan Dies Natalis ke-58 yaitu Sidang Terbuka Senat Universitas Trisakti, Selasa (28/11/2023). Turut hadir dalam acara tersebut Rektor Universitas Trisakti Kadarsah Suryadi.


SCROLL TO CONTINUE WITH CONTENT


""Kami berterima kasih mendapat kesempatan untuk berkontribusi dalam kegiatan ini. Semoga dapat konsisten dalam mempromosikan inovasi dan kewirausahaan teknologi yang berkelanjutan serta mengembangkan green campus yang handal dan berdaya saing,"" kata Iqbal dalam keterangan tertulis, Kamis (30/11/2023).

Dia mengatakan penggunaan teknologi saat ini juga akan semakin memudahkan generasi muda untuk berwirausaha. Peluang untuk generasi muda menjadi entrepreneur pun sangat terbuka. Peluang entrepreneur bukan hanya datang dengan memanfaatkan potensi pasar dalam negeri, tetapi juga pasar luar negeri yang saat ini semakin terintegrasi.

""Untuk membedakan diri dari kompetitor, maka seorang wirausaha harus berinovasi dan mengembangkan kreativitas. Hal ini juga akan semakin dimudahkan dengan perkembangan teknologi yang semakin canggih saat ini,"" tutur Iqbal.

Selain mendukung pengembangan wirausaha, dalam kesempatan tersebut, BNI turut menyerahkan bantuan kepada Trisakti untuk mendukung kegiatan kemahasiswaan khususnya di bidang marching band dan mini orchestra.

""Bantuan ini diberikan mengingat kegiatan seni khususnya orkestra dan marching band bagi para mahasiswa sebagai calon wirausaha dan entrepreneur perlu diperkuat guna penguasaan seni dan melatih keterampilan mahasiswa,"" tutupnya"
"Go Green, BNI Rehabilitasi Hutan Pesisir Anyer & Hulu DAS Citarum",detikNews,"Minggu, 27 Mar 2022 14:15 WIB",https://news.detik.com/berita/d-6003125/go-green-bni-rehabilitasi-hutan-pesisir-anyer-hulu-das-citarum,"PT Bank Negara Indonesia (Persero) Tbk (BNI) mendorong program kepedulian lingkungan untuk memulihkan kondisi alam. Kali ini, BNI melakukan program rehabilitasi lingkungan kawasan pesisir Pantai Anyer, Banten dan hulu Sungai DAS Citarum, Jawa Barat.

Adapun program yang dilakukan Bank dengan kode saham BBNI ini bekerja sama dengan Yayasan Kita Jaga Alam (KJA). Keduanya melakukan program pengembangan kebun bibit serta penanaman dan perawatan pohon di dua lokasi tersebut.

Ketua Dewan Pembina Yayasan Kita Jaga Alam Letnan Jenderal (Purnawirawan) Doni Monardo yang hadir dalam peresmian acara menjelaskan kerja sama program ini menggunakan mekanisme CSR. Ia merinci program ini berupa pembibitan 100.000 pohon di area Pantai Anyer, pembibitan 200.000 pohon di area hulu DAS Sungai Citarum, biaya kegiatan penanaman, sekaligus biaya kegiatan pemeliharaan pohon.


SCROLL TO CONTINUE WITH CONTENT


Dalam kesempatan ini Doni mengatakan bahwa menyiapkan pembibitan pohon di tepi pantai merupakan program kemanusiaan. Sebab, hal ini secara tidak langsung menekan dampak terburuk akibat bencana alam bagi generasi yang akan datang.

""Kami harap program BNI Go Green dapat terus berlangsung guna terus memberikan manfaat bagi lingkungan dan masyarakat sekitar,"" kata Doni dalam keterangan tertulis, Minggu (27/3/2022).

Sementara itu, Corporate Secretary BNI Mucharom yang hadir membuka program Penanaman Pohon di Pantai Anyer menuturkan kerugian yang ditimbulkan oleh bencana alam terkadang sangat besar sehingga menimbulkan dampak kepada sektor ekonomi dan perubahan alam itu sendiri.

Oleh karena itu, pihaknya sebagai pionir Green Banking dan agen pembangunan pemerintah yang ditugaskan untuk konstruksi ekonomi berkelanjutan berupaya memperluas kemitraan. Sekaligus mendorong program-program kepedulian sosial yang berbasis lingkungan.

""Kami berharap program hari ini dapat bermanfaat dan menjadi penyemangat bagi korporasi lain untuk tak hanya fokus pada eksploitasi, tetapi juga pada penjagaan serta kelestarian lingkungan,"" ungkap Mucharom.

Mucharom menerangkan periode program ini berjalan sejak Maret sampai dengan Desember 2022. Adapun bentuk implementasi program berupa edukasi mengenai rehabilitasi hutan, pembibitan, serta mitigasi bencana bagi para pegawai dan masyarakat.

Selain itu, ada pula program employee volunteer untuk penanaman pohon oleh pegawai BNI bersama KJA.

Sebagai informasi, kegiatan peresmian program ini turut dihadiri pula oleh Dalam acara peresmiannya Deputi dan Direktur Pencegahan Bencana BNPB Jarwansyah.

Simak juga 'RK Laporkan Progres Pemulihan Citarum ke Luhut, Apa Hasilnya?':"
Fakta Kebijakan PMN untuk BUMN,detikNews,"Kamis, 12 Agu 2021 16:23 WIB",https://news.detik.com/berita/d-5679601/fakta-kebijakan-pmn-untuk-bumn,"Pemerintah bersama DPR telah memutuskan akan memberikan Penyertaan Modal Kerja (PMN) kepada 12 Badan Usaha Milik Negara (BUMN) pada 2022 dengan total Rp 72,44 triliun. Menteri BUMN Erick Thohir mengatakan PMN ini dibutuhkan untuk mendukung pemulihan ekonomi pasca-Covid-19. Terutama untuk meneruskan proyek-proyek yang sudah berjalan saat ini.

Dia menyebutkan, alokasi PMN bagi perusahaan BUMN untuk tahun depan lebih banyak untuk mendukung program layanan publik, mulai dari infrastruktur untuk menurunkan biaya logistik, pengadaan listrik hingga pengadaan perumahan.

""Saat ini PMN diperlukan tetapi ini tentu bukan proyek baru, tetapi proyek ini untuk pasca Covid-19, sangat penting,"" kata Erick dalam keterangan tertulis, Kamis (12/8/2021)


SCROLL TO CONTINUE WITH CONTENT


Adapun 12 BUMN yang mendapatkan PMN antara lain.

1. Hutama Karya Rp 31,35 triliun, untuk proyek Jalan Tol Trans Sumatera;

2. BUMN Pariwisata in Journey (Aviasi Pariwisata Indonesia/Aviata) Rp 9,318 T, permodalan dan restrukturisasi, dan proyek Mandalika;

3. PLN Rp 8,231 triliun, untuk transmisi gardu induk dan listrik perdesaan;

4. BNI Rp 7 triliun, untuk penguatan modal tier 1 dan CAR (rasio kecukupan modal);

5. KAI-KCJB Rp 4,1 triliun, untuk PSN Kereta Cepat;

6. Waskita Karya Rp 3 triliun, untuk penguatan modal, dan restrukturisasi;

7. IFG Rp 2 triliun, untuk restrukturisasi Jiwasraya;

8. Adhi Karya Rp 2 triliun, untuk jalan tol Solo-DIY, Bawen dan proyek SPAM Karian-Serpong;

9. Perumnas Rp 2 triliun, untuk perumahan rakyat berpenghasilan menengah rendah (MBR);

10. Bank BTN Rp 2 T, untuk penguatan modal tier 1 dan CAR;

11. RNI Rp 1,2 T, untuk penguatan industri pangan

12. Damri Rp 250 miliar, untuk penguatan modal dan penyediaan armada.

Erick menambahkan BUMN tengah melakukan transformasi bisnis. Harapannya dengan tambahan modal ini BUMN akan dapat melakukan aksi korporasi yang akan berdampak pada kinerja perusahaan, sehingga bisa memberikan pendapatan tambahan untuk negara.

""Di mana kami BUMN terus melakukan transformasi agar tetap bisa melakukan aksi korporasi karena negara perlu tambahan income, selain pajak, terutama pada saat Covid seperti ini. Tapi juga tidak kalah penting, ini yang penting PSO (public service obligation), hal ini yang membedakan BUMN dengan swasta,"" terangnya.

PMN yang diberikan oleh negara kepada BUMN pun bukan cuma-cuma, mereka nantinya akan melakukan 'pengembalian' dalam bentuk pajak, dividen, maupun penerimaan negara bukan pajak (PNBP). Dalam 10 tahun terakhir, pihaknya mencatat BUMN berkontribusi Rp 3.295 triliun kepada negara dalam bentuk dividen, pajak dan pendapatan negara bukan pajak (PNBP).

Nilai Rp 3.295 triliun itu terbagi atas pajak Rp 1.872 triliun atau 54%, dividen Rp 388 triliun atau 11%, dan PNBP Rp 1.035 triliun atau 30%. Dari nilai tersebut, PMN yang diberikan hanya sekitar 4% saja atau Rp 147 triliun setoran BUMN dalam satu dekade.

Bahkan ketika pandemi menyerang pada 2020, BUMN menyumbangkan dividen total sebesar Rp 45 triliun. Jumlah ini turun dibandingkan 2019 senilai Rp 51 triliun, karena tekanan pandemi Covid-19 yang berdampak pada kinerja perusahaan pelat merah.

Adapun lima BUMN berkontribusi terbesar pada dividen kepada negara, yakni PT Bank Rakyat Indonesia (Persero) Tbk dengan kontribusi sebesar 26,4% dari total dividen BUMN. Selanjutnya, PT Bank Mandiri (Persero) Tbk sebesar 22,2%, PT Pertamina (Persero) 19,1, PT Telkom Indonesia (Persero) Tbk 17,8% dan PT BNI (Persero) Tbk 5,2%.

Sementara sumbangan PNBP lainnya pada 2020 senilai Rp 86 triliun pada 2020. Kontribusi PNBP tersebut terdiri dari pembayaran royalti, iuran minyak dan gas (migas), iuran jasa kepelabuhan, dan lain-lain.

Selain dalam bentuk penerimaan negara, BUMN juga berkontribusi pada pemerataan ekonomi melalui pemerataan infrastruktur. Saat ini biaya logistik di Indonesia masih jauh lebih tinggi jika dibandingkan dengan negara lain. Jika biaya logistik di Indonesia sebesar 24%, negara lain bisa lebih hemat 11%.

Pun kebutuhan untuk menyediakan listrik di seluruh Indonesia juga masih sangat tinggi. Sebab saat ini masih banyak daerah yang masih belum dialiri listrik oleh PT PLN (Persero).

Sama halnya dengan pengadaan perumahan untuk masyarakat yang dijalankan oleh Perum Perumnas dan PT Bank Tabungan Negara (Persero) Tbk (BBTN).

Ekonom Bina Nusantara University, Mochammad Doddy Ariefianto mengatakan BUMN berpotensi memberikan pendapatan bagi negara, namun tidak semata hanya dilihat dari potensi keuntungannya.

Pasalnya, BUMN tidak hanya melakukan bisnis secara komersial melainkan ada bagian melayani publik. Untuk BUMN yang komersial pun dalam sebuah bisnis membutuhkan modal sehingga seringkali PMN ini dilakukan.

""Dalam teori finance penambahan modal itu ada hitungannya, pemberian modal diberikan pada BUMN yang mampu memberikan return. Kalau PMN diberikan kepada BUMN yang sedang sakit maka ada pertimbangan lain, apakah BUMN tersebut strategis atau menyangkut hajat hidup orang banyak. Untuk BUMN yang murni komersial, kita bicara bisnis dasar pemberian modal, kalau komersial bisa dari potensi bisnis ke depannya,"" kata dia.

Sementara khusus untuk BUMN Infrastruktur, penyertaan modal dibutuhkan karena pembangunan harus tetap berjalan. Jika pembangunan infrastruktur terhenti atau mangkrak maka biayanya akan jauh lebih mahal ketika pembangunan dilanjutkan, potensi korosi pada besi atau rangka menjadi salah satu penyebabnya.

""Kalau tidak dilanjutkan proyeknya kena korosi dan kualitasnya rusak, jembatan yang dibiarkan karena dananya dialokasikan untuk proyek lainnya atau penanganan pandemi nanti malahan melanjutkannya bisa dari ulang lagi. BUMN Karya membawa mandat pemerintah, saat ini kan mau meningkatkan kinerja ekonomi karena konektivitas harus ditingkatkan karena logistik indonesia mahal,"" ungkap Doddy.

""Mereka bisa dibilang tidak murni komersial karena membawa tugas publik, khusus infrastruktur tidak gampang buat dipending,"" sambungnya.

Sementara PMN yang diberikan untuk dua bank pelat merah yakni BBNI dan BBTN menurutnya ada pertimbangan dari potensi kedua bank tersebut kedepannya. BBTN misalnya difokuskan untuk mempercepat kepemilikan rumah bagi masyarakat, sementara BBNI akan memperkuat jaringan luar negerinya, sehingga berkontribusi pada peningkatan ekspor baik korporasi maupun UMKM.

Dengan PMN yang diberikan kepada keduanya maka dari pemenuhan dari sisi publik dan komersial bisa dipenuhi. Apalagi BBNI pada 2020 menjadi salah satu penyumbang terbesar setoran dividen di antara BUMN yang lainnya.

""PMN BUMN ini tidak sederhana karena membawa mandat publik dan komersial, berbeda dengan swasta pertimbangannya murni untung rugi,"" pungkasnya."
Berapa Harga Saham BBCA Hari Ini?,detikFinance,"Senin, 11 Nov 2024 12:45 WIB",https://finance.detik.com/bursa-dan-valas/d-7632680/berapa-harga-saham-bbca-hari-ini,"Saham Bank Central Asia (BBCA) turun ke zona merah mengekor Indeks Harga Saham Gabungan (IHSG) yang berada di zona merah. IHSG pagi tadi berada di level 7.200-an

Berdasarkan data RTI, Senin (11/11/2024), pukul 09.10 WIB perdagangan IHSG dibuka di level 7.262,82, melemah 24 poin atau 0,33%. IHSG bergerak di level tertinggi 7.287,25 dan level terendah 7.255,73.

Melansir Bursa Efek Indonesia (BEI), saham BBCA hari ini dibuka melemah ke level Rp 9.900 dimana sebelumnya harga saham BBCA berada di angka Rp 10.075.


    SCROLL TO CONTINUE WITH CONTENT
  

Pelemahan ini dinilai karena adanya pengaruh faktor ekonomi makro global dan domestik yang memengaruhi adanya sentiman investor terhadap saham bank raksasa di Indonesia.

Pasalnya tak hanya BBCA yang anjlok, tapi juga semua saham bank plat merah seperti Bank Nasional Indonesia (BBNI), Bank Rakyat Indonesia (BBRI), dan Bank Mandiri (BMRI) ikut melemah di hari ini.

Fluktuasi atau pergerakan saham BBCA hari ini diprediksi bergerak di kisaran angka Rp 9.800 - Rp 10.950. Sedakan selama 2024 saham BBCA bergerak di angka Rp 8.675 - Rp 10.950.

Sebagai informasi, pada kuartal III 2024 Bank Central Asia berhasil catatkan laba bersih sebesar Rp 41,1 triliun dimana angka ini tumbuh 12,8% dari tahun sebelumnya pada periode yang sama . Laba per saham juga ikut naik 16,16% menjadi Rp 115.000.

Demikian informasi terkait harga saham BBCA hari ini, semoga bermanfaat ya detikers!

Lihat juga video: Pengaruh Pemilihan Umum Amerika Serikat Terhadap Pasar"
