title,category,publish_date,article_url,content
"Dunia Menyambut Prabowo, Presiden ke-8 Republik Indonesia",detikNews,"Senin, 19 Feb 2024 11:08 WIB",https://news.detik.com/kolom/d-7200280/dunia-menyambut-prabowo-presiden-ke-8-republik-indonesia,"Banyak orang senang mendengar lagu-lagu lama. Tak pernah bosan meski diputar berulang-ulang. Tak ketinggalan dengan Pilpres 2024. ""Lagu lama"" soal kecurangan pemilu, bergema merespons kemenangan telak sekali putaran Prabowo-Gibran.

Tudingan dan kecurigaan itu bisa dipahami. Bagaimana pun, kemenangan Prabowo-Gibran adalah sejarah dalam politik demokrasi Indonesia, khususnya di era reformasi. Untuk pertama kalinya kontestasi pilpres yang berisi pertarungan lebih dari dua paslon dimenangkan hanya dengan sekali putaran.

Namun, jika dilihat dengan kacamata holistik, seperti kata Profesor Mahfud MD, tuduhan kecurangan adalah lagu yang biasa didendangkan oleh mereka yang kalah. Secara puitik bahkan dapat dikatakan, menuduh curang adalah hak istimewa yang hanya dimiliki oleh mereka yang kalah. Pendapat Prof Mahfud ini sungguh layak didengar dan mestinya tidak dilupakan.


SCROLL TO CONTINUE WITH CONTENT


Kisah serupa sebenarnya bisa kita temukan di berbagai penjuru dunia. Pada Pilpres Amerika Serikat tahun 2020 misalnya, kubu Donald Trump secara konsisten dan masif mengatakan kemenangan Joe Biden sebagai bentuk kecurangan. Tuduhan itu bahkan belum berhenti sampai sekarang.

Filsuf Jerman Friedrich Nietzsche menyebut perilaku semacam itu sebagai slave mentality atau ""mental budak"". Alih-alih berlapang dada mengakui kekalahan, mereka yang bermental budak (bukan bermental kesatria) akan mencari ribuan pembenaran dan penyangkalan atas kekalahannya.

Ini ibarat orang yang tidak mampu membeli mobil mewah. Alih-alih bekerja keras agar bisa membeli mobil mewah seperti tetangganya, ia justru menyebut tetangganya sedang pamer kekayaan dan bersikap sombong.

Dalam perspektif intelijen, narasi kecurangan yang dituduhkan kepada Prabowo-Gibran saat ini telah masuk ke tahap intensifikasi. Ada empat langkah yang sedang dan telah dilakukan. Pertama, kubu 01 dan 03 membuat siaran pers yang memberi sinyal-sinyal ke masyarakat bahwa kecurangan itu ada.

Merespons hasil quick count, kubu 01 dan 03 terlihat menggunakan narasi yang nyaris seragam. Seolah-olah kemenangan sekali putaran Prabowo-Gibran tidak mungkin terjadi. TPN Ganjar-Mahfud bahkan melempar sinyal seolah-olah akan menggandeng Timnas AMIN untuk mengusut berbagai dugaan kecurangan di Pilpres 2024.

Kedua, media sosial dibanjiri dengan berbagai konten yang menunjukkan kecurangan pemilu. Dulu, Menteri Propaganda Nazi Paul Joseph Goebbels menggunakan teknik semacam ini. Prinsip dari teknik Goebbels adalah menyebarluaskan berita bohong melalui media massa sebanyak mungkin dan sesering mungkin hingga kemudian kebohongan tersebut dianggap sebagai suatu kebenaran. Sederhana namun mematikan.

Ketiga, dibuatnya pemberitaan bahwa dunia internasional tidak menerima kemenangan Prabowo-Gibran. Terlihat adanya upaya untuk mengamplifikasi berbagai headline pemberitaan media asing yang menggunakan diksi-diksi negatif terhadap Prabowo-Gibran. Strategi ini jelas menggunakan prinsip inferiority complex. Diksi-diksi negatif itu seolah valid, hanya karena diberitakan oleh media-media asing.

Keempat, meskipun belum terjadi, namun bau-baunya sudah tercium. Dikhawatirkan tahap intensifikasi akan menuju pada tahap eksploitasi dalam beberapa pekan ke depan. Mereka yang tidak menerima hasil Pilpres 2024 akan melakukan berbagai demonstrasi penolakan. Modus operandi seperti ini juga terlihat di Pilpres Amerika Serikat 2020.

Singkatnya, tuduhan kecurangan sangat mungkin akan terus bergema sampai pelantikan resmi di bulan Oktober nanti. Oleh karenanya, saya akan menggunakan pengukuran yang lebih objektif dalam melihat kemenangan Prabowo-Gibran di Pilpres 2024, yakni pengakuan negara lain.

Pengakuan negara lain atau negara sahabat adalah legitimasi objektif. Saya mengatakan objektif karena negara-negara tersebut jelas bukan partisan. Mereka bukan kubu 01 atau kubu 03 yang menjadi kompetitor Prabowo-Gibran. Kemudian, ini yang terpenting, ucapan selamat tidak mungkin disampaikan secara sembarangan oleh suatu negara.

Kembali saya tekankan, berbagai ucapan selamat itu tidak mungkin sembarang dikeluarkan. Pasti sudah ada verifikasi, konfirmasi, informasi A1, dan berbagai uji validitas sebelum ucapan diberikan. Ada peran lembaga intelijen tiap negara untuk memberikan informasi yang akurat dan terpercaya. Apalagi setahu saya, setiap kali Indonesia menggelar pemilu, banyak negara counterpart mengirimkan petugas intelijennya untuk ikut memantau.

Hingga hari ini, ucapan selamat ke Prabowo Subianto sudah datang dari sejumlah negara tetangga, Eropa, hingga Amerika Serikat. Ada yang menelpon secara langsung, ada yang melalui media sosial, ada pula yang mengutus duta besarnya untuk bertemu langsung.

Dari kawasan tetangga ada Perdana Menteri Malaysia Anwar Ibrahim, Perdana Menteri Australia Anthony Albanese, Perdana Menteri Singapura Lee Hsien Loong dan Presiden Sri Lanka Ranil Wickremesinghe. Dari Eropa ada Perdana Menteri Republik Ceko Petr Fiala, Perdana Menteri Belanda Mark Rutte, Presiden Rusia Vladimir Putin, dan Perdana Menteri Inggris Rishi Sunak. Dari Amerika Serikat, ucapan selamat juga sudah disampaikan oleh Juru Bicara Departemen Luar Negeri Amerika Serikat, Matthew Miller.

Dalam hubungan internasional, ucapan selamat oleh suatu negara tidak sama dengan ucapan selamat dalam hubungan sehari-hari yang kerap kali hanya bersifat normatif. Dalam hubungan internasional, sebuah ucapan selamat apalagi yang menyangkut hasil pemilu, hanya menegaskan bahwa yang bersangkutan telah diakui kemenangannya.

Mirip seperti pengakuan kemerdekaan, ucapan selamat dari berbagai pemimpin dunia itu merupakan pengakuan mereka bahwa Prabowo Subianto telah terpilih sebagai Presiden ke-8 Republik Indonesia.

Ucapan selamat itu, menurut saya sebenarnya juga dapat diliihat sebagai buah dari kiprah diplomasi pertahanan Prabowo selama menjadi Menteri Pertahanan (Menhan). Secara meyakinkan dapat dikatakan bahwa Prabowo telah berhasil membangun hubungan dan komunikasi internasional yang baik.

Kunjungannya ke berbagai negara di Asia, Eropa, hingga Amerika bukan hanya sekadar untuk membahas rencana belanja alutsista, melainkan juga untuk membangun pertemanan internasional yang hangat. Tak mengherankan jika kini, negara-negara tersebut kemudian mengaku siap untuk membangun kerja sama dengan Indonesia di bawah kepemimpinan Prabowo Subianto.

Dengan kata lain, ucapan selamat yang terus mengalir untuk Prabowo, sesungguhnya merupakan bantahan tegas atas narasi-narasi buruk yang menyebut seolah-olah dunia internasional tidak menerima kemenangan Prabowo-Gibran. Apalagi, sambutan dunia terhadap Prabowo tidak hanya terlihat dari ucapan selamat berbagai negara, melainkan juga dari pandangan positif pengamat luar negeri.

Profesor Hubungan Internasional dan Politik Komparatif Universitas Sydney, Justin Hastings misalnya, mengatakan Australia akan cepat bekerja sama dengan Prabowo karena kebijakan luar negerinya akan mengikuti kontur kebijakan pemerintah sebelumnya, yakni pemerintahan Jokowi.

Hastings juga menegaskan bahwa Prabowo akan menjadi Presiden pro-Indonesia, Presiden yang tidak condong atau anti dengan Amerika Serikat, Australia ataupun Tiongkok. Dengan Prabowo yang tidak begitu kritis terhadap AUKUS jika dibandingkan pemimpin Asia Tenggara lainnya, Hastings melihat prospek kesepakatan pertahanan Australia dan Indonesia akan lebih positif di bawah Prabowo.

Selain ucapan selamat, hangatnya sambutan terhadap kemenangan Prabowo-Gibran juga terlihat jelas dari pasar ekonomi. Pasar keuangan Indonesia dan Wall Street merespons positif hasil Pilpres 2024 yang dimenangkan sekali putaran.

Indeks Harga Saham Gabungan (IHSG) melesat. IHSG pada penutupan perdagangan pada Kamis (15/2/2024) ditutup di posisi 7.303,28. Indeks menguat 93,5 poin atau 1,30 persen.

Penguatan IHSG terjadi seiring dengan melesatnya saham bank big cap. Empat bank buku-IV dengan kapitalisasi pasar terbesar di IHSG kompak menguat. Bank Rakyat Indonesia (Persero) Tbk (BBRI) melonjak 2,08 persen, Bank Mandiri (Persero) Tbk (BMRI) naik 2,49 persen, Bank Negara Indonesia (Persero) Tbk (BBNI) terapresiasi 2,13 persen, dan Bank Central Asia Tbk (BBCA) menguat 1,29 persen.

Salah satu saham yang kenaikannya menjadi sorotan adalah PT PP (Persero) Tbk (PTPP), sebagai salah satu BUMN karya yang terimbas positif dengan kuatnya suara Prabowo-Gibran, baik di quick count maupun real count KPU.

Melesatnya saham PTPP disebabkan karena Prabowo akan melanjutkan program pembangunan era Presiden Jokowi, khususnya Ibu Kota Nusantara (IKN). Pada perdagangan Kamis lalu, saham PTPP melambung hingga 24,44 persen.

***

Sebagai penutup, selain memberi selamat atas kemenangan sekali putaran Prabowo-Gibran, bolehlah kita sedikit genit bermain tebak-tebakan. Dunia sudah menyambut dan menggelar karpet merah, lantas negara manakah yang akan menjadi tujuan kunjungan pertama Prabowo setelah terpilih sebagai Presiden ke-8 Republik Indonesia?

Jakarta, 19 Februari 2024

KHAIRUL FAHMIInstitute for Security and Strategic Studies (ISESS)"
Berapa Harga Saham BBCA Hari Ini?,detikFinance,"Senin, 11 Nov 2024 12:45 WIB",https://finance.detik.com/bursa-dan-valas/d-7632680/berapa-harga-saham-bbca-hari-ini,"Saham Bank Central Asia (BBCA) turun ke zona merah mengekor Indeks Harga Saham Gabungan (IHSG) yang berada di zona merah. IHSG pagi tadi berada di level 7.200-an

Berdasarkan data RTI, Senin (11/11/2024), pukul 09.10 WIB perdagangan IHSG dibuka di level 7.262,82, melemah 24 poin atau 0,33%. IHSG bergerak di level tertinggi 7.287,25 dan level terendah 7.255,73.

Melansir Bursa Efek Indonesia (BEI), saham BBCA hari ini dibuka melemah ke level Rp 9.900 dimana sebelumnya harga saham BBCA berada di angka Rp 10.075.


    SCROLL TO CONTINUE WITH CONTENT
  

Pelemahan ini dinilai karena adanya pengaruh faktor ekonomi makro global dan domestik yang memengaruhi adanya sentiman investor terhadap saham bank raksasa di Indonesia.

Pasalnya tak hanya BBCA yang anjlok, tapi juga semua saham bank plat merah seperti Bank Nasional Indonesia (BBNI), Bank Rakyat Indonesia (BBRI), dan Bank Mandiri (BMRI) ikut melemah di hari ini.

Fluktuasi atau pergerakan saham BBCA hari ini diprediksi bergerak di kisaran angka Rp 9.800 - Rp 10.950. Sedakan selama 2024 saham BBCA bergerak di angka Rp 8.675 - Rp 10.950.

Sebagai informasi, pada kuartal III 2024 Bank Central Asia berhasil catatkan laba bersih sebesar Rp 41,1 triliun dimana angka ini tumbuh 12,8% dari tahun sebelumnya pada periode yang sama . Laba per saham juga ikut naik 16,16% menjadi Rp 115.000.

Demikian informasi terkait harga saham BBCA hari ini, semoga bermanfaat ya detikers!

Lihat juga video: Pengaruh Pemilihan Umum Amerika Serikat Terhadap Pasar"
Dua Mata Pisau Penghapusan Utang UMKM,detikFinance,"Jumat, 08 Nov 2024 15:15 WIB",https://finance.detik.com/berita-ekonomi-bisnis/d-7628709/dua-mata-pisau-penghapusan-utang-umkm,"Proses pendataan UMKM yang masuk dalam kategori penghapusan utang tengah dilakukan berbagai pihak yang berkepentingan. Salah satunya adalah Kementerian Kelautan dan Perikanan (KKP). Dalam kesempatan nya, Sakti Wahyu Trenggono yang sebelumnya telah mempelajari mekanisme penghapusan utang ini kini tengah menjangkau beberapa nelayan di sejumlah titik.

Hal ini berkaitan dengan ditekennya Peraturan Presiden (PP) Nomor 47 Tahun 2024 tentang Penghapusan Piutang Macet kepada UMKM dalam Bidang Pertanian, Perkebunan, Peternakan, Perikanan dan Kelautan, serta UMKM lainnya. Mengutip detikSumut, nilai utang yang dihapuskan maksimal Rp 500 juta untuk unit usaha dan Rp 300 juta untuk perorangan.

""Rata-rata maksimal untuk badan usaha itu maksimal Rp 500 juta yang utang piutangnya berutang maksimal Rp 500 juta. Untuk perorangan 300 juta,"" kata Menteri Usaha Mikro, Kecil, dan Menengah (UMKM) Maman Abdurrahman, dilansir dari detikSumut, Selasa (5/11/2024).


    SCROLL TO CONTINUE WITH CONTENT
  

Lebih lanjut, Maman mengatakan jika kebijakan ini merupakan bentuk keberpihakan pemerintah kepada masyarakat pelaku UMKM. Meski demikian, tidak semua pelaku UMKM berhak menerima keuntungan dari kebijakan ini. Mereka harus memenuhi beberapa syarat agar hutang mereka dapat diputihkan, syarat pertama adalah masyarakat pelaku usaha yang terkena dampak bencana alam mulai dari gempa bumi hingga Covid.

Kedua, bagi pelaku UMKM yang mempunyai hutang sudah jatuh tempo dan tidak mampu melunasinya. Pelaku UMKM harus terlebih dahulu diproses penghapusan buku di bank BUMN. Ketiga, UMKM yang dapat dihapuskan hutangnya terdaftar sebagai nasabah bank Badan Usaha Milik Negara (BUMN).

Kalangan Legislatif menyambut baik kebijakan ini. Bahkan, Wakil Ketua DPR RI Cucun Ahmad Syamsurijal menyebut jika penghapusan ini merupakan kesempatan bagi UMKM untuk reborn. Namun demikian, ada ekses yang diendus beriringan dengan hal ini.

Merangkum detikFinance, ada pergolakan di pasar saham sehari setelah peraturan ini disahkan. Bersumber dari RTI Business pada Rabu (6/11/2024) mayoritas pergerakan saham bank-bank Himbara terpantau melemah. Dalam pantauan detikFinance kala itu, saham PT Bank Rakyat Indonesia Tbk(BBRI) turun 1,06% ke level 4.660, PT Bank Mandiri Tbk (BMRI) terkoreksi 3,25% ke level 6.700, PT Bank Negara Indonesia (BBNI) melemah 3,24% menjadi 5.225 dan PT Bank Tabungan Negara Tbk (BBTN) menguat 0,73% ke level 1.380.

Meski disebut jika faktor eksternal lebih berpengaruh daripada kebijakan ini, namun tetap saja penghapusan utang oleh sejumlah bank plat merah menjadi pertimbangan para pemain saham. Lalu bagaimana dengan hari ini? apakah ada sikap yang diambil oleh pihak perbankan terkait kebijakan ini? seberapa efektif kebijakan ini akan mempengaruhi kinerja UMKM di masa depan? Ikuti diskusinya bersama Wakil Redaktur Pelaksana detikFinance dan Amin Nurdin, Senior Faculty Lembaga Pengembangan Perbankan Indonesia dalam Editorial Review.

Indonesia Detik Ini akan mengulas peristiwa yang tengah panas di kawasan Tangerang. Diketahui, sejumlah truk pengangkut tanah dirusak warga menyusul adanya kecelakaan yang membuat kaki seorang anak terluka parah. Terbaru, konflik muncul atas adanya warga yang geram akibat truk melintas di luar jam operasional yang disepakati. Bagaimana kelanjutan peristiwa ini? Ikuti laporan jurnalis detikcom langsung dari lokasi kejadian.

Sementara itu, di penghujung acara nanti, detikSore akan menghadirkan founder Yayasan Alzheimer Indonesia. detikSore akan mengulas lebih dalam penyakit Alzheimer yang angkanya diperkirakan meningkat dibalik ketidaktahuan masyarakat tentang isu kesehatan ini. Mari belajar bersama tentang bahaya Alzheimer dalam Sunsetalk jelang matahari terbenam nanti.

Ikuti terus ulasan mendalam berita-berita hangat detikcom dalam sehari yang disiarkan secara langsung langsung (live streaming) pada Senin-Jumat, pukul 15.30-18.00 WIB, di 20.detik.com dan TikTok detikcom. Jangan ketinggalan untuk mengikuti analisis pergerakan pasar saham jelang penutupan IHSG di awal acara. Sampaikan komentar Anda melalui kolom live chat yang tersedia.

""Detik Sore, Nggak Cuma Hore-hore!""

Simak juga video: UMKM yang Terdaftar di BPOM Baru 9 Ribu dari Jutaan"
"Prabowo Hapus Utang UMKM, Begini Efeknya ke Saham Perbankan",detikFinance,"Rabu, 06 Nov 2024 13:44 WIB",https://finance.detik.com/bursa-dan-valas/d-7625075/prabowo-hapus-utang-umkm-begini-efeknya-ke-saham-perbankan,"Presiden Prabowo Subianto telah menandatangani Peraturan Pemerintah (PP) Nomor 47 Tahun 2024 tentang Penghapusan Piutang Macet kepada usaha Mikro Kecil dan Menengah dalam bidang Pertanian, Perkebunan, Peternakan, Perikanan, Kelautan serta UMKM lainnya. Melalui aturan ini, kredit macet bagi para pelaku usaha UMKM, petani, hingga nelayan akan dihapuskan, khususnya pada bank-bank Badan Usaha Milik Negara (BUMN).

Berdasarkan pantauan detikcom di RTI Business, Rabu (6/11/2024) sehari setelah aturan tersebut diteken, mayoritas pergerakan saham bank-bank Himbara terpantau melemah. Saat berita ini ditulis, saham PT Bank Rakyat Indonesia Tbk(BBRI) turun 1,06% ke level 4.660, PT Bank Mandiri Tbk (BMRI) terkoreksi 3,25% ke level 6.700, PT Bank Negara Indonesia (BBNI) melemah 3,24% menjadi 5.225. Sementara itu, PT Bank Tabungan Negara Tbk (BBTN) menguat 0,73% ke level 1.380.

Menanggapi hal tersebut, Senior Investment Information Mirae Asset Sekuritas Indonesia Nafan Aji Gusta mengatakan pergerakan saham melemah yang dialami oleh bank-bank Himbara lebih banyak berpengaruh pada faktor eksternal. Dia menilai kebijakan Prabowo soal hapus utang tagih tersebut tidak berpengaruh pada pergerakan saham di bank-bank Himbara ke depannya.


    SCROLL TO CONTINUE WITH CONTENT
  

""Iya (tidak berpengaruh). Sentimen global jauh lebih kuat ya daripada sentimen domestik. Sebenarnya kalau faktor pelemahan bank BUMN lebih dipengaruhi faktor eksternal. Para pelaku pasar memfaktorkan terkait dengan speculation bahwasannya Trump akan jadi pemenang di US Election. Jadi, pelaku pasar cenderung bersikap hati-hati,"" kata Nafan kepada detikcom, Rabu (6/11/2024).

Dia pun menilai dengan adanya kebijakan tersebut, pemerintah memberi keleluasaan dalam mengembangkan bisnis sehingga ada potensi pemulihan ekonomi lebih lanjut di domestik. Perbankan pun sering kali melakukan pemutihan kredit di masa-masa sulit, seperti krisis moneter 1998, krisis keuangan global di 2008, hingga krisis pandemi COVID-19.

""Di satu sisi, pemerintah saat ini memiliki janji politik untuk mewujudkan pertumbuhan ekonomi di atas 5%,"" jelasnya.

Senada, Associate Director of Research and Investment Pilarmas Investindo Sekuritas, Maximilianus Nico Demus mengatakan apabila diperhatikan lebih lanjut kebijakan itu justru memberikan dampak positif bagi para petani dan nelayan ke depannya, khususnya bagi peningkatan dan penyaluran kredit yang selama ini tertahan.

Dia menjelaskan kebijakan itu juga mempunyai syarat atau kriteria bagi penerimanya. Dengan kriteria tersebut, dia bilang dapat mengukur seberapa besar dampak yang diberikan kepada perbankan. Salah satu kriterianya, yakni bagi pelaku UMKM, petani, serta nelayan yang tidak memiliki kemampuan membayar.

""Hal itu menjelaskan bahwa apabila ternyata dinilai masih mampu untuk membayar oleh bank-bank Himbara, maka tidak akan dihapuskan. Tentu hal ini memberikan gambaran bahwa tidak semua bisa dihapuskan, karena ada syarat tersebut. Memang betul, akan akan ada gejolak dan tekanan, tapi hanya jangka pendek,"" kata Nico kepada detikcom.

Lebih lanjut, secara jangka panjang, dia melihat dengan fundamental bank-bank Himbara, hal ini seharusnya akan memberikan katalis positif. Sebab, kebijakan itu akan memberikan kesempatan pertumbuhan ekonomi untuk berjalan kembali, dan masyarakat dapat kembali mengajukan utang.

""Apalagi, yang dihapuskan adalah yang benar benar sudah tidak bisa tertolong kembali,"" imbuh dia.

Namun, dia menjelaskan masih terlalu dini untuk mengukur seberapa besar dampak aturan tersebut kepada perbankan. Sama halnya seperti relaksasi perbankan akibat Covid-19 lalu, saham-saham bank mengalami tekanan, tapi seiring waktu saham bank justru mengalami pemulihan.

""Setiap kali ada kebijakan, sedikit banyak pasti akan berpengaruh. Untuk mengukur seberapa besar dampak tersebut, kita membutuhkan langkah langkah yang lebih detail yang akan dilakukan terkait hal tersebut. Oleh sebab itu, biasanya laporan keuangan juga akan membantu kita mengetahui, seberapa besar dampak dari penghapusan utang. Namun untuk saat ini, terlalu dini mengatakan bahwa kebijakan tersebut berdampak atau tidaknya,"" terang dia.

Simak Video Pernyataan Prabowo Setelah Hapus Utang UMKM-Petani-Nelayan

 "
IHSG Hari Ini Diramal Bergerak Fluktuatif,detikFinance,"Selasa, 05 Nov 2024 08:13 WIB",https://finance.detik.com/bursa-dan-valas/d-7622634/ihsg-hari-ini-diramal-bergerak-fluktuatif,"Mega Capital Sekuritas X InvestasiKu dalam laporan hariannya menjelaskan Indeks Harga Saham Gabungan (IHSG) diperkirakan bergerak fluktuatif cenderung melemah terbatas dengan rentang 7.420-7.550.

IHSG pada perdagangan lalu ditutup kembali melemah, yaitu melemah 0,34% ke level 7.479. Aksi jual investor asing mulai mereda yang ditandai oleh aksi net buy sebesar Rp 52,94 miliar dengan 5 saham yang paling banyak dibeli yaitu ASII, INDF, BBRI, BMRI, dan BBNI.

Secara sektoral, pelemahan IHSG tertekan oleh sektor bahan baku, konsumen non primer, dan infrastruktur. Sentimen penguatan harga minyak berpotensi positif untuk sektor bahan baku, namun negatif untuk sektor transportasi.


    SCROLL TO CONTINUE WITH CONTENT
  

Kemudian mayoritas bursa saham global kompak terkoreksi, pelemahan dipimpin oleh indeks Dow Jones. Hal ini seiring sikap pelaku pasar yang berhati-hati menjelang hasil pemilu AS, pasalnya popularitas kedua calon sama-sama tinggi sehingga menimbulkan risiko ""deadlocked parliament"" yang merupakan kondisi sama kuat antara partai pengusung.

Pasar juga khawatir kepastian terkait sosok pemimpin AS berikutnya baru diketahui pada Januari 2025, jika pemilu perdana ini hasilnya berimbang. Bursa Asia turut melemah, pasar mencermati kongres NPC Tiongkok yang berlangsung 4-8 November 2024 ini. Mega Capital SekuritasNovember 05, 2024

Data

IHSG 7479.503 (-0.34%) Nikkei 38053.67 (0%) Hangseng 20567.52 (0.3%) Kospi 2588.97 (1.83%) Strait Times Index 3572.04 (0.47%)TWSE 22965.39 (0.81%) SET 1462.95 (-0.08%) Shanghai 3310.207 (1.17%)  FTSE 100 8184.24 (0.09%) Xetra Dax 19147.85 (-0.56%) Dow Jones 41794.6 (-0.61%)Nasdaq 18179.98 (-0.33%) S&P 500 5712.69 (-0.28%)

Lihat Video: Keadaan Politik Amerika dan koreksi Bursa Global Jadi Faktor Pelemahan IHSG"
