title,category,publish_date,article_url,content
Dua Mata Pisau Penghapusan Utang UMKM,detikFinance,"Jumat, 08 Nov 2024 15:15 WIB",https://finance.detik.com/berita-ekonomi-bisnis/d-7628709/dua-mata-pisau-penghapusan-utang-umkm,"Proses pendataan UMKM yang masuk dalam kategori penghapusan utang tengah dilakukan berbagai pihak yang berkepentingan. Salah satunya adalah Kementerian Kelautan dan Perikanan (KKP). Dalam kesempatan nya, Sakti Wahyu Trenggono yang sebelumnya telah mempelajari mekanisme penghapusan utang ini kini tengah menjangkau beberapa nelayan di sejumlah titik.

Hal ini berkaitan dengan ditekennya Peraturan Presiden (PP) Nomor 47 Tahun 2024 tentang Penghapusan Piutang Macet kepada UMKM dalam Bidang Pertanian, Perkebunan, Peternakan, Perikanan dan Kelautan, serta UMKM lainnya. Mengutip detikSumut, nilai utang yang dihapuskan maksimal Rp 500 juta untuk unit usaha dan Rp 300 juta untuk perorangan.

""Rata-rata maksimal untuk badan usaha itu maksimal Rp 500 juta yang utang piutangnya berutang maksimal Rp 500 juta. Untuk perorangan 300 juta,"" kata Menteri Usaha Mikro, Kecil, dan Menengah (UMKM) Maman Abdurrahman, dilansir dari detikSumut, Selasa (5/11/2024).


    SCROLL TO CONTINUE WITH CONTENT
  

Lebih lanjut, Maman mengatakan jika kebijakan ini merupakan bentuk keberpihakan pemerintah kepada masyarakat pelaku UMKM. Meski demikian, tidak semua pelaku UMKM berhak menerima keuntungan dari kebijakan ini. Mereka harus memenuhi beberapa syarat agar hutang mereka dapat diputihkan, syarat pertama adalah masyarakat pelaku usaha yang terkena dampak bencana alam mulai dari gempa bumi hingga Covid.

Kedua, bagi pelaku UMKM yang mempunyai hutang sudah jatuh tempo dan tidak mampu melunasinya. Pelaku UMKM harus terlebih dahulu diproses penghapusan buku di bank BUMN. Ketiga, UMKM yang dapat dihapuskan hutangnya terdaftar sebagai nasabah bank Badan Usaha Milik Negara (BUMN).

Kalangan Legislatif menyambut baik kebijakan ini. Bahkan, Wakil Ketua DPR RI Cucun Ahmad Syamsurijal menyebut jika penghapusan ini merupakan kesempatan bagi UMKM untuk reborn. Namun demikian, ada ekses yang diendus beriringan dengan hal ini.

Merangkum detikFinance, ada pergolakan di pasar saham sehari setelah peraturan ini disahkan. Bersumber dari RTI Business pada Rabu (6/11/2024) mayoritas pergerakan saham bank-bank Himbara terpantau melemah. Dalam pantauan detikFinance kala itu, saham PT Bank Rakyat Indonesia Tbk(BBRI) turun 1,06% ke level 4.660, PT Bank Mandiri Tbk (BMRI) terkoreksi 3,25% ke level 6.700, PT Bank Negara Indonesia (BBNI) melemah 3,24% menjadi 5.225 dan PT Bank Tabungan Negara Tbk (BBTN) menguat 0,73% ke level 1.380.

Meski disebut jika faktor eksternal lebih berpengaruh daripada kebijakan ini, namun tetap saja penghapusan utang oleh sejumlah bank plat merah menjadi pertimbangan para pemain saham. Lalu bagaimana dengan hari ini? apakah ada sikap yang diambil oleh pihak perbankan terkait kebijakan ini? seberapa efektif kebijakan ini akan mempengaruhi kinerja UMKM di masa depan? Ikuti diskusinya bersama Wakil Redaktur Pelaksana detikFinance dan Amin Nurdin, Senior Faculty Lembaga Pengembangan Perbankan Indonesia dalam Editorial Review.

Indonesia Detik Ini akan mengulas peristiwa yang tengah panas di kawasan Tangerang. Diketahui, sejumlah truk pengangkut tanah dirusak warga menyusul adanya kecelakaan yang membuat kaki seorang anak terluka parah. Terbaru, konflik muncul atas adanya warga yang geram akibat truk melintas di luar jam operasional yang disepakati. Bagaimana kelanjutan peristiwa ini? Ikuti laporan jurnalis detikcom langsung dari lokasi kejadian.

Sementara itu, di penghujung acara nanti, detikSore akan menghadirkan founder Yayasan Alzheimer Indonesia. detikSore akan mengulas lebih dalam penyakit Alzheimer yang angkanya diperkirakan meningkat dibalik ketidaktahuan masyarakat tentang isu kesehatan ini. Mari belajar bersama tentang bahaya Alzheimer dalam Sunsetalk jelang matahari terbenam nanti.

Ikuti terus ulasan mendalam berita-berita hangat detikcom dalam sehari yang disiarkan secara langsung langsung (live streaming) pada Senin-Jumat, pukul 15.30-18.00 WIB, di 20.detik.com dan TikTok detikcom. Jangan ketinggalan untuk mengikuti analisis pergerakan pasar saham jelang penutupan IHSG di awal acara. Sampaikan komentar Anda melalui kolom live chat yang tersedia.

""Detik Sore, Nggak Cuma Hore-hore!""

Simak juga video: UMKM yang Terdaftar di BPOM Baru 9 Ribu dari Jutaan"
"Prabowo Hapus Utang UMKM, Begini Efeknya ke Saham Perbankan",detikFinance,"Rabu, 06 Nov 2024 13:44 WIB",https://finance.detik.com/bursa-dan-valas/d-7625075/prabowo-hapus-utang-umkm-begini-efeknya-ke-saham-perbankan,"Presiden Prabowo Subianto telah menandatangani Peraturan Pemerintah (PP) Nomor 47 Tahun 2024 tentang Penghapusan Piutang Macet kepada usaha Mikro Kecil dan Menengah dalam bidang Pertanian, Perkebunan, Peternakan, Perikanan, Kelautan serta UMKM lainnya. Melalui aturan ini, kredit macet bagi para pelaku usaha UMKM, petani, hingga nelayan akan dihapuskan, khususnya pada bank-bank Badan Usaha Milik Negara (BUMN).

Berdasarkan pantauan detikcom di RTI Business, Rabu (6/11/2024) sehari setelah aturan tersebut diteken, mayoritas pergerakan saham bank-bank Himbara terpantau melemah. Saat berita ini ditulis, saham PT Bank Rakyat Indonesia Tbk(BBRI) turun 1,06% ke level 4.660, PT Bank Mandiri Tbk (BMRI) terkoreksi 3,25% ke level 6.700, PT Bank Negara Indonesia (BBNI) melemah 3,24% menjadi 5.225. Sementara itu, PT Bank Tabungan Negara Tbk (BBTN) menguat 0,73% ke level 1.380.

Menanggapi hal tersebut, Senior Investment Information Mirae Asset Sekuritas Indonesia Nafan Aji Gusta mengatakan pergerakan saham melemah yang dialami oleh bank-bank Himbara lebih banyak berpengaruh pada faktor eksternal. Dia menilai kebijakan Prabowo soal hapus utang tagih tersebut tidak berpengaruh pada pergerakan saham di bank-bank Himbara ke depannya.


    SCROLL TO CONTINUE WITH CONTENT
  

""Iya (tidak berpengaruh). Sentimen global jauh lebih kuat ya daripada sentimen domestik. Sebenarnya kalau faktor pelemahan bank BUMN lebih dipengaruhi faktor eksternal. Para pelaku pasar memfaktorkan terkait dengan speculation bahwasannya Trump akan jadi pemenang di US Election. Jadi, pelaku pasar cenderung bersikap hati-hati,"" kata Nafan kepada detikcom, Rabu (6/11/2024).

Dia pun menilai dengan adanya kebijakan tersebut, pemerintah memberi keleluasaan dalam mengembangkan bisnis sehingga ada potensi pemulihan ekonomi lebih lanjut di domestik. Perbankan pun sering kali melakukan pemutihan kredit di masa-masa sulit, seperti krisis moneter 1998, krisis keuangan global di 2008, hingga krisis pandemi COVID-19.

""Di satu sisi, pemerintah saat ini memiliki janji politik untuk mewujudkan pertumbuhan ekonomi di atas 5%,"" jelasnya.

Senada, Associate Director of Research and Investment Pilarmas Investindo Sekuritas, Maximilianus Nico Demus mengatakan apabila diperhatikan lebih lanjut kebijakan itu justru memberikan dampak positif bagi para petani dan nelayan ke depannya, khususnya bagi peningkatan dan penyaluran kredit yang selama ini tertahan.

Dia menjelaskan kebijakan itu juga mempunyai syarat atau kriteria bagi penerimanya. Dengan kriteria tersebut, dia bilang dapat mengukur seberapa besar dampak yang diberikan kepada perbankan. Salah satu kriterianya, yakni bagi pelaku UMKM, petani, serta nelayan yang tidak memiliki kemampuan membayar.

""Hal itu menjelaskan bahwa apabila ternyata dinilai masih mampu untuk membayar oleh bank-bank Himbara, maka tidak akan dihapuskan. Tentu hal ini memberikan gambaran bahwa tidak semua bisa dihapuskan, karena ada syarat tersebut. Memang betul, akan akan ada gejolak dan tekanan, tapi hanya jangka pendek,"" kata Nico kepada detikcom.

Lebih lanjut, secara jangka panjang, dia melihat dengan fundamental bank-bank Himbara, hal ini seharusnya akan memberikan katalis positif. Sebab, kebijakan itu akan memberikan kesempatan pertumbuhan ekonomi untuk berjalan kembali, dan masyarakat dapat kembali mengajukan utang.

""Apalagi, yang dihapuskan adalah yang benar benar sudah tidak bisa tertolong kembali,"" imbuh dia.

Namun, dia menjelaskan masih terlalu dini untuk mengukur seberapa besar dampak aturan tersebut kepada perbankan. Sama halnya seperti relaksasi perbankan akibat Covid-19 lalu, saham-saham bank mengalami tekanan, tapi seiring waktu saham bank justru mengalami pemulihan.

""Setiap kali ada kebijakan, sedikit banyak pasti akan berpengaruh. Untuk mengukur seberapa besar dampak tersebut, kita membutuhkan langkah langkah yang lebih detail yang akan dilakukan terkait hal tersebut. Oleh sebab itu, biasanya laporan keuangan juga akan membantu kita mengetahui, seberapa besar dampak dari penghapusan utang. Namun untuk saat ini, terlalu dini mengatakan bahwa kebijakan tersebut berdampak atau tidaknya,"" terang dia.

Simak Video Pernyataan Prabowo Setelah Hapus Utang UMKM-Petani-Nelayan

 "
IHSG Hari Ini Diramal Bergerak Fluktuatif,detikFinance,"Selasa, 05 Nov 2024 08:13 WIB",https://finance.detik.com/bursa-dan-valas/d-7622634/ihsg-hari-ini-diramal-bergerak-fluktuatif,"Mega Capital Sekuritas X InvestasiKu dalam laporan hariannya menjelaskan Indeks Harga Saham Gabungan (IHSG) diperkirakan bergerak fluktuatif cenderung melemah terbatas dengan rentang 7.420-7.550.

IHSG pada perdagangan lalu ditutup kembali melemah, yaitu melemah 0,34% ke level 7.479. Aksi jual investor asing mulai mereda yang ditandai oleh aksi net buy sebesar Rp 52,94 miliar dengan 5 saham yang paling banyak dibeli yaitu ASII, INDF, BBRI, BMRI, dan BBNI.

Secara sektoral, pelemahan IHSG tertekan oleh sektor bahan baku, konsumen non primer, dan infrastruktur. Sentimen penguatan harga minyak berpotensi positif untuk sektor bahan baku, namun negatif untuk sektor transportasi.


    SCROLL TO CONTINUE WITH CONTENT
  

Kemudian mayoritas bursa saham global kompak terkoreksi, pelemahan dipimpin oleh indeks Dow Jones. Hal ini seiring sikap pelaku pasar yang berhati-hati menjelang hasil pemilu AS, pasalnya popularitas kedua calon sama-sama tinggi sehingga menimbulkan risiko ""deadlocked parliament"" yang merupakan kondisi sama kuat antara partai pengusung.

Pasar juga khawatir kepastian terkait sosok pemimpin AS berikutnya baru diketahui pada Januari 2025, jika pemilu perdana ini hasilnya berimbang. Bursa Asia turut melemah, pasar mencermati kongres NPC Tiongkok yang berlangsung 4-8 November 2024 ini. Mega Capital SekuritasNovember 05, 2024

Data

IHSG 7479.503 (-0.34%) Nikkei 38053.67 (0%) Hangseng 20567.52 (0.3%) Kospi 2588.97 (1.83%) Strait Times Index 3572.04 (0.47%)TWSE 22965.39 (0.81%) SET 1462.95 (-0.08%) Shanghai 3310.207 (1.17%)  FTSE 100 8184.24 (0.09%) Xetra Dax 19147.85 (-0.56%) Dow Jones 41794.6 (-0.61%)Nasdaq 18179.98 (-0.33%) S&P 500 5712.69 (-0.28%)

Lihat Video: Keadaan Politik Amerika dan koreksi Bursa Global Jadi Faktor Pelemahan IHSG"
"Masuk Daftar 45 Saham Pre-opening, Saham GOTO Makin Likuid?",detikFinance,"Selasa, 29 Okt 2024 08:30 WIB",https://finance.detik.com/bursa-dan-valas/d-7610863/masuk-daftar-45-saham-pre-opening-saham-goto-makin-likuid,"Manajemen PT GoTo Gojek Tokopedia Tbk (GOTO) akan mengumumkan kinerja keuangan Q3-2024 pada Rabu 30 Oktober pekan ini. Jelang rilis kinerja ini, saham GOTO kembali masuk dalam daftar saham yang bisa diperdagangkan melalui sesi pra-pembukaan (pre-opening) di Pasar Reguler.

Saham GOTO bersanding dengan 44 saham lainnya yang dimasukkan oleh Bursa Efek Indonesia (BEI) dalam daftar saham paling likuid ini. Sesi pre-opening ini pertama kali dibuka lagi oleh BEI sejak 7 September 2020 setelah sempat ditiadakan akibat dampak pandemi.

Adapun daftar total 45 saham ini terungkap dalam pengumuman BEI yang diteken Kepala Divisi Pengaturan dan Operasional Perdagangan BEI, Pande Made Kusuma Ari dan PH Kepala Divisi Riset BEI, Heidy Ruswita Sari pada 25 Oktober 2024.


    SCROLL TO CONTINUE WITH CONTENT
  

Pra-pembukaan adalah sesi awal waktu perdagangan di Pasar Reguler di setiap Hari Bursa yang bisa digunakan Anggota Bursa (sekuritas) untuk memasukkan penawaran jual-beli saham, sehingga memungkinkan pembentukan harga pembukaan atas saham itu berdasarkan harga terbaik dan volume terbanyak (call auction). Jam pre-opening antara 08.45-08.59 dan pre-closing 15.50-16.00 WIB.

""Dengan merujuk pada Peraturan Nomor II-A tentang Perdagangan Efek Bersifat Ekuitas dan berdasarkan hasil evaluasi atas daftar saham yang digunakan dalam penghitungan Indeks LQ45, berikut daftar saham yang dapat diperdagangkan di sesi pra-pembukaan mulai 1 November 2024 sampai 31 Januari 2025,"" tulis pengumuman BEI.

Mengacu data BEI, sepekan terakhir (21-25 Oktober), saham GOTO berada di urutan pertama saham dengan volume perdagangan terbanyak di BEI yakni 23,46 miliar saham atau porsinya mencapai 17,18% dari total saham yang di-trading-kan di bursa.

Selanjutnya, urutan kedua ada saham PT Bumi Resources Tbk (BUMI) sebanyak 10,81 miliar saham atau 7,91% dari total saham yang diperdagangkan. Sementara itu, dari sisi nilai transaksi, saham GOTO masuk urutan ke-8 terbesar yakni Rp1,66 triliun, teratas ditempati saham PT Bank Rakyat Indonesia Tbk (BBRI) Rp4,69 triliun.

Dalam keterangan resminya, manajemen GOTO menyatakan akan merilis laporan keuangan per September 2024 atau periode 9 bulan (Q3) pada 30 Oktober mendatang.

Menurut Analis BRI Danareksa Sekuritas, Niko Margaronis, GOTO berpotensi mencatatkan pertumbuhan EBITDA di kuartal III-2024 yang didorong oleh segmen On-Demand Services (ODS) dan segmen Financial Technology (FinTech) lewat GoTo Financial.

Selanjutnya, menurut Niko, tingkat penerimaan (take rate) ODS tetap solid, dan penyaluran pinjaman naik 20% secara kuartalan, dengan take rate meningkat sebesar 10-15 basis poin (bps).

""Biaya variabel yang stabil akan mendorong pertumbuhan marjin kontribusi yang tinggi hingga belasan persen dan memposisikan GOTO untuk mencapai EBITDA yang positif di kuartal III-2024 dan pemulihan yang kuat dari kerugian semester I-2024 di tengah recurring costs yang flat,"" tulis Niko dalam laporan riset yang dirilis pada Selasa 15 Oktober 2024.

Indeks LQ45

Selain itu, BEI juga melakukan evaluasi mayor untuk Indeks LQ45. Indeks LQ45 adalah indeks acuan yang berisi 45 saham dengan kriteria, salah satunya masuk dalam 60 perusahaan dengan kapitalisasi pasar terbesar di BEI dalam 12 bulan terakhir. Kriteria lain yakni likuiditas perdagangan yang tinggi, kondisi fundamental perusahaan, dan prospek pertumbuhan bisnis.

Ada dua saham yang baru masuk yakni Adaro Minerals Indonesia (ADMR) dan Summarecon Agung (SMRA) menggantikan dua saham yang dicoret yakni Gudang Garam (GGRM) dan Harum Energy (HRUM).

Daftar 45 Saham Terbaru Indeks LQ45 dan Bisa Diperdagangkan di Sesi Pra-Opening

1. ACES, Aspirasi Hidup Indonesia Tbk.2. ADMR, Adaro Minerals Indonesia Tbk. (Baru)3. ADRO, Adaro Energy Indonesia Tbk.4. AKRA, AKR Corporindo Tbk.5. AMMN, Amman Mineral Internasional Tbk.6. AMRT, Sumber Alfaria Trijaya Tbk.7. ANTM, Aneka Tambang Tbk.8. ARTO, Bank Jago Tbk.9. ASII, Astra International Tbk.10. BBCA, Bank Central Asia Tbk.11. BBNI, Bank Negara Indonesia (Persero) Tbk.12. BBRI, Bank Rakyat Indonesia (Persero) Tbk.13. BBTN, Bank Tabungan Negara (Persero) Tbk.14. BMRI, Bank Mandiri (Persero) Tbk.15. BRIS, Bank Syariah Indonesia Tbk.16. BRPT, Barito Pacific Tbk.17. BUKA, Bukalapak.com Tbk.18. CPIN, Charoen Pokphand Indonesia Tbk19. ESSA, ESSA Industries Indonesia Tbk.20. EXCL, XL Axiata Tbk.21. GOTO, GoTo Gojek Tokopedia Tbk.22. ICBP, Indofood CBP Sukses Makmur Tbk.23. INCO, Vale Indonesia Tbk.24. INDF, Indofood Sukses Makmur Tbk.25. INKP, Indah Kiat Pulp & Paper Tbk.26. INTP, Indocement Tunggal Prakarsa Tbk.27. ISAT, Indosat Tbk.28. ITMG, Indo Tambangraya Megah Tbk.29. JSMR, Jasa Marga (Persero) Tbk.30. KLBF, Kalbe Farma Tbk.31. MAPI, Mitra Adiperkasa Tbk.32. MBMA, Merdeka Battery Materials Tbk.33. MDKA, Merdeka Copper Gold Tbk.34. MEDC, Medco Energi Internasional Tbk.35. MTEL, Dayamitra Telekomunikasi Tbk.36. PGAS, Perusahaan Gas Negara Tbk.37. PGEO, Pertamina Geothermal Energy Tbk.38. PTBA, Bukit Asam Tbk.39. SIDO, Industri Jamu dan Farmasi Sido Muncul Tbk.40. SMGR, Semen Indonesia (Persero) Tbk.41. SMRA Summarecon Agung Tbk. (Baru)42. TLKM, Telkom Indonesia (Persero) Tbk.43. TOWR, Sarana Menara Nusantara Tbk.44. UNTR, United Tractors Tbk.45. UNVR, Unilever Indonesia Tbk.

Lebih lanjut, daftar Indeks LQ45 ini juga akan efektif berlaku pada 1 November hingga 31 Januari 2025. Dari indeks ini, ada beberapa saham dengan bobot cukup besar terhadap indeks setelah dilakukan evaluasi di antaranya saham Bank Central Asia (BBCA) 15%, Bank Rakyat Indonesia (BBRI) 15%, Bank Mandiri (BMRI) 13,01%, Telkom (TLKM) 6,98%, Astra International (ASII) 4,29%, GoTo Gojek (GOTO) 3,51%, dan Sumber Alfaria Trijaya (AMRT) 3,18%.

Menurut ulasan MNC Sekuritas salah satu faktor penting bagi trader dalam menentukan saham incaran adalah likuiditas saham.

""Saham yang likuid artinya saham yang aktif diperdagangkan, ditandai dengan selalu adanya antrian order. Minat pasar terhadap suatu saham akan tercermin dari frekuensi dan volume perdagangan,"" tulis MNC Sekuritas dalam situs resminya.

Lihat Video: Komisaris William Tanuwijaya Jual 332 Juta Lembar Sahamnya di GOTO

 "
"Aset Kantor Luar Negeri BNI Tumbuh 14,55% Kuartal III 2024",detikFinance,"Jumat, 25 Okt 2024 22:28 WIB",https://finance.detik.com/moneter/d-7606672/aset-kantor-luar-negeri-bni-tumbuh-14-55-kuartal-iii-2024,"PT Bank Negara Indonesia (Persero) Tbk atau BNI (BBNI) mencatatkan pertumbuhan total aset tahunan Kantor Luar Negeri (KLN) sebesar 14,55% secara tahunan (yoy) pada kuartal III-2024. Pertumbuhan ini terjadi di tengah gejolak ekonomi dan geopolitik global.

Direktur Wholesale & International Banking BNI Agung Prabowo mengatakan, di tengah kondisi gejolak yang dipengaruhi berbagai faktor seperti inflasi, perubahan kebijakan suku bunga global dan juga ketidakpastian geopolitik, kinerja kantor luar negeri BNI tetap menunjukkan ketahanan yang kuat.

""Hal ini dibuktikan oleh keberhasilan BNI yang mencatatkan pertumbuhan total aset year on year (yoy) pada kuartal III 2024 sebesar 14,55%,"" kata Agung, dalam Konferensi Pers Paparan Kinerja Kuartal III 2024 BNI, disiarkan secara daring, Jumat (25/10/2024).


    SCROLL TO CONTINUE WITH CONTENT
  

Meskipun menghadapi tantangan eksternal, menurutnya, kantor luar negeri BNI terus beradaptasi dengan strategi diversifikasi portfolio, pengelolaan risiko yang hati-hati dan penguatan layanan berbasis teknologi. Upaya ini membantu mempertahankan pertumbuhan yang stabil meskipun dalam kondisi pasar yang bergejolak.

Agung menambahkan, salah satu sektor yang menjadi penopang utama kinerja kantor luar negeri (KLN) BNI adalah sektor korporasi internasional, terutama dalam bisnis loan, pembiayaan perdagangan atau trade finance, energi, infrastruktur dan manufaktur.

""Pertumbuhan pada sektor-sektor ini didorong oleh peningkatan permintaan dari perusahaan multinasional dan klien-klien lokal di negara-negara tempat BNI beroperasi,"" ujarnya.

Sejalan dengan pertumbuhan total aset ini, sampai dengan periode kuartal III 2024, earnings before tax kantor luar negeri BNI juga mengalami pertumbuhan sebesar 59,13% year on year (yoy).

Di samping itu, BNI juga tidak menampik kemungkinan pembukaan KLN baru. Agung mengatakan, terakhir pada September 2024 BNI telah meresmikan kantor perwakilan baru di pusat bisnis di Sydney, Australia. Kehadirannya melengkapi jaringan global BNI di kota-kota strategis dunia seperti di Singapura, Hongkong, Tokyo, London, Seoul, New York dan Amsterdam.

""Dalam memperluas jaringan internasional kami melihat adanya potensi besar yang masih dapat digarap terutama di negara-negara dengan prospek bisnis yang menjanjikan. Jadi sebelum membuka kantor baru di luar negeri tentunya kita melakukan studi kelayakan terlebih dahulu untuk memastikan potensi pasar dan kebutuhan nasabah di lokasi tersebut,"" ujar dia.

Dalam perluasan jaringan internasional, lanjut Agung, BNI mengidentifikasi peluang berdasarkan jumlah diaspora Indonesia di negara tujuan, besar investasi negara tersebut di Indonesia, volume perdagangan, jumlah perusahaan yang berbisnis dengan Indonesia, dan jumlah perusahaan Indonesia di negara tersebut.

""Pembukaan kantor baru akan didasarkan pada hasil kajian yang mendalam terkait potensi pasar dan relevansinya terhadap penguatan bisnis BNI di luar negeri. Fokus utama adalah meningkatkan kinerja kantor-kantor luar negeri yang sudah ada sekaligus memperluas layanan sektor-sektor dengan potensi pertumbuhan yang tinggi,"" katanya."
"BNI Salurkan Kredit Rp 735 T, Bidik Pertumbuhan 12% di Akhir 2024",detikFinance,"Jumat, 25 Okt 2024 21:28 WIB",https://finance.detik.com/moneter/d-7606620/bni-salurkan-kredit-rp-735-t-bidik-pertumbuhan-12-di-akhir-2024,"PT Bank Negara Indonesia (Persero) Tbk atau BNI (BBNI) mencatatkan penyaluran kredit sebesar Rp 735,02 triliun, naik 9,48% secara tahunan (yoy). BNI membidik hingga akhir tahun, pertumbuhan kredit berada di kisaran 10-12%.

Direktur Keuangan BNI Novita Widya mengatakan pertumbuhan ini didorong oleh segmen korporasi yang mencatat kenaikan sebesar 15,1% YoY menjadi Rp409,2 triliun dan segmen konsumer yang naik 14,6% YoY menjadi Rp137 triliun. Pendorong utamanya ialah kredit personal (payroll) dan Kredit Pemilikan Rumah (KPR).

""Tahun ini untuk segmen menengah dan kecil masih difokuskan dalam hal perbaikan credit underwriting sehingga kedua segmen ini akan siap menjadi diversifikasi pertumbuhan kredit BNI tahun depan,"" kata Novita, dalam Konferensi Pers Paparan Kinerja Kuartal III 2024 BNI, disiarkan secara daring, Jumat (25/10/2024).


    SCROLL TO CONTINUE WITH CONTENT
  

Anak Perusahaan BNI, seperti BNI Finance, telah menjadi mesin pertumbuhan baru. Salah satu contohnya adalah kolaborasi antara BNI dan BNI Finance dalam pembiayaan bersama (joint financing) untuk meningkatkan kredit segmen consumer, terutama untuk produk Kredit Kendaraan Bermotor (KKB). Hasilnya, penyaluran KKB mencapai Rp 1 triliun per September 2024, naik dibandingkan periode 2023.

Selain itu, Hibank yang memiliki fokus pada UMKM juga tumbuh. Penyaluran kredit dari Hibank telah bertumbuh 90,5% YoY dari Rp 1,7 triliun, menjadi Rp3,2 triliun di September 2024 dengan memanfaatkan ekosistem grup BNI.

Kualitas aset BNI terus membaik, ditandai dengan rasio kredit bermasalah atau Non-Performing Loan (NPL) bertahan di level 2%. Kredit berisiko atau Loan at Risk (LaR) membaik menjadi 11,8%, sehingga Cost of Credit (CoC) dapat dijaga di angka 1%. Beban provisi juga turun sebesar 19,7% YoY menjadi Rp5,4 triliun.

Penyaluran kredit BNI yang sehat juga di-support oleh pertumbuhan dana CASA (giro dan tabungan). Per September 2024, CASA BNI mampu tumbuh 5,5% YoY terutama ditopang oleh tabungan yang mampu tumbuh solid 7,4% YoY.

Untuk mendorong pertumbuhan kredit, Novita mengatakan, pihaknya akan berfokus pada segmen bisnis yang sehat, antara lain segmen korporasi dan segmen consumer. BNI juga akan menguatkan peran dari perusahaan anak dan manajemen likuiditas yang baik.

""Ini tentunya kami optimis akan dapat mencapai pertumbuhan kredit di kisaran 10-12% di akhir 2024,"" kata Novita.

Menurutnya, peluang pertumbuhan bisnis juga terlihat dari membaiknya proyeksi pertumbuhan PDB yang sesuai dengan visi dari pemerintah baru dengan memfokuskan pada sektor-sektor yang prioritas seperti hilirisasi, ketahanan pangan dan energi, hingga perumahan.

""Sehingga, di tahun 2025 tentunya kita proyeksikan pertumbuhan kredit lebih baik dibanding tahun 2024,"" tutupnya."
